### ISSUE TITLE
Unneeded TCP RST packets after frontend connection breaks down gracefully.

### ISSUE THREAD

**Issue by xschlef** [kzemek/go-mmproxy#13]
Hi,

if a tcp connection terminates normally via fin, fin-ack, mmproxy also sends a RST packet to the proxied service. This leads to a lot of unneeded rst packets as the service will also respond to the rst.

1. frontend connection is closed with fin
2. mmproxy sends rst to backend
3. backend responds to rst
4. mmproxy sends rst to frontend

```
20:12:04.078724 lo    In  IP 10.0.0.1.44834 > 127.0.0.1.636: Flags [S], seq 562770295, win 65495, options [mss 65495,sackOK,TS val 190922939 ecr 0,nop,wscale 7], length 0
20:12:04.078733 lo    In  IP 127.0.0.1.636 > 10.0.0.1.44834: Flags [S.], seq 209013022, ack 562770296, win 65483, options [mss 65495,sackOK,TS val 1111425203 ecr 190922939,nop,wscale 7], length 0
...
20:12:04.092111 lo    In  IP 10.0.0.1.44834 > 127.0.0.1.636: Flags [P.], seq 541:594, ack 6884, win 512, options [nop,nop,TS val 190922953 ecr 1111425216], length 53
20:12:04.092170 lo    In  IP 10.0.0.1.44834 > 127.0.0.1.636: Flags [F.], seq 594, ack 6884, win 512, options [nop,nop,TS val 190922953 ecr 1111425216], length 0
20:12:04.092193 lo    In  IP 127.0.0.1.636 > 10.0.0.1.44834: Flags [P.], seq 6884:6908, ack 595, win 512, options [nop,nop,TS val 1111425217 ecr 190922953], length 24
20:12:04.092204 lo    In  IP 10.0.0.1.44834 > 127.0.0.1.636: Flags [R], seq 562770890, win 0, length 0
```

At the moment this is just an educated guess, but sending out RST packets for each closing connection looks quite overkill. mmproxy should close the connection to the backend correctly instead of terminating it via RST.

**Comment by kzemek** [comment]
Thanks for the report! The issue was with how go-mmproxy handle partial socket shutdowns. When it received a FIN from client-side, it immediately closes both sides. To be a good proxy, it needs to forward the FIN and wait on the backend response.

This is fixed now on the main branch
